<?xml version="1.0" encoding="UTF-8"?>
<factura
    xmlns:xs="http://www.w3.org/2001/XMLSchema"
    xs:noNamespaceSchemaLocation="factura.xsd">

        <capçalera id="F4">
        <data dia="05" mes="05" any="2025"/>
        <client nom_fiscal="Decatlonh" nom_comercial="Decatlonh SAU" nif="E93591293"/>
        <proveidor nom_fiscal="Fisitek" nom_comercial="Fisitek SAU" nif="A73291256"/>
    </capçalera>
    <linia id="E9" article_ref="A8">
        <article id="A8">
            <descripcio>Balones de basket BBASKET</descripcio>
            <preus>
                <sense_iva>50</sense_iva>
                <amb_iva>61</amb_iva>
            </preus>
            <tipu_iva aplicat="21"/>
        </article>
        <num_unitats>100</num_unitats>
        <import_total>6100</import_total>
    </linia>
    <linia id="E10" article_ref="A10">
        <article id="A10">
            <descripcio>Pelotas de tenis TK</descripcio>
            <preus>
                <sense_iva>10</sense_iva>
                <amb_iva>11</amb_iva>
            </preus>
            <tipu_iva aplicat="10"/>
        </article>
        <num_unitats>1000</num_unitats>
        <import_total>11000</import_total>
    </linia>
    <linia id="E11" article_ref="A11">
        <article id="A11">
            <descripcio>Pelotas de futbol FBK</descripcio>
            <preus>
                <sense_iva>10</sense_iva>
                <amb_iva>10.4</amb_iva>
            </preus>
            <tipu_iva aplicat="4"/>
        </article>
        <num_unitats>100</num_unitats>
        <import_total>1000.4</import_total>
    </linia>
    <resum_total>
        <subtotal>
            <iva_4>1000.4</iva_4>
            <iva_10>11000</iva_10>
            <iva_21>6100</iva_21>
        </subtotal>
        <total_sense_iva>11600.04</total_sense_iva>
        <total_amb_iva>11700.04</total_amb_iva>
    </resum_total>

    
</factura> 